<?xml version="1.0" ?>
<template xmlns="http://schemas.sulu.io/template/template"
          xmlns:xsi="http://www.w3.org/2001/XMLSchema-instance"
          xsi:schemaLocation="http://schemas.sulu.io/template/template http://schemas.sulu.io/template/template-1.0.xsd">

    <key>publish-required</key>

    <view>views/pages/page</view>
    <controller>Sulu\Content\UserInterface\Controller\Website\ContentController::indexAction</controller>
    <cacheLifetime>2400</cacheLifetime>

    <tag name="sulu_content.request_workflow" workflow="publish_required"/>

    <meta>
        <title lang="en">Description required to publish</title>
        <title lang="de">Beschreibung zum Veröffentlichen erforderlich</title>
    </meta>

    <properties>
        <property name="title" type="text_line" mandatory="true">
            <meta>
                <title lang="en">Title</title>
                <title lang="de">Titel</title>
            </meta>

            <tag name="sulu.rlp.part"/>
        </property>

        <property name="url" type="route">
            <meta>
                <title lang="en">Resourcelocator</title>
                <title lang="de">Adresse</title>
            </meta>

            <tag name="sulu.rlp"/>
        </property>

        <property name="description" type="text_line">
            <meta>
                <title lang="en">Description</title>
                <title lang="de">Beschreibung</title>
            </meta>

            <tag name="sulu_content.publish_required_pre_validator"/>
        </property>
    </properties>
</template>
