<?xml version="1.0" ?>
<template xmlns="http://schemas.sulu.io/template/template"
          xmlns:xsi="http://www.w3.org/2001/XMLSchema-instance"
          xsi:schemaLocation="http://schemas.sulu.io/template/template http://schemas.sulu.io/template/template-1.0.xsd">

    <key>default</key>

    <view>@ExampleTest/examples/default</view>
    <controller>Sulu\Content\UserInterface\Controller\Website\ContentController::indexAction</controller>
    <cacheLifetime>604800</cacheLifetime>

    <meta>
        <title lang="en">Example</title>
        <title lang="de">Example</title>
    </meta>

    <properties>
        <property name="title" type="text_line" mandatory="true">
            <meta>
                <title lang="en">Title</title>
                <title lang="de">Titel</title>
            </meta>

            <params>
                <param name="headline" value="true"/>
            </params>

            <tag name="sulu.rlp.part"/>
            <tag name="sulu.search.field" role="title"/>
        </property>

        <property name="url" type="route">
            <meta>
                <title lang="en">Resourcelocator</title>
                <title lang="de">Adresse</title>
            </meta>

            <tag name="sulu.rlp"/>
            <tag name="sulu.search.field" role="url"/>
        </property>

        <property name="description" type="text_area">
            <meta>
                <title lang="en">Description</title>
                <title lang="de">Beschreibung</title>
            </meta>

            <tag name="sulu.search.field" role="description"/>
        </property>

        <property name="image" type="single_media_selection">
            <meta>
                <title lang="en">Image</title>
                <title lang="de">Bild</title>
            </meta>

            <tag name="sulu.search.field" role="image"/>
        </property>

        <property name="article" type="text_editor">
            <meta>
                <title lang="en">Article</title>
                <title lang="de">Artikel</title>
            </meta>

            <tag name="sulu.search.field" type="string"/>
        </property>

        <block name="blocks" default-type="text">
            <meta>
                <title lang="en">Content</title>
                <title lang="de">Inhalt</title>
            </meta>

            <types>
                <type name="heading">
                    <meta>
                        <title lang="en">Heading</title>
                        <title lang="de">Überschrift</title>
                    </meta>

                    <properties>
                        <property name="heading" type="text_line">
                            <meta>
                                <title lang="en">Heading</title>
                                <title lang="de">Überschrift</title>
                            </meta>

                            <tag name="sulu.search.field" type="string"/>
                        </property>
                    </properties>
                </type>

                <type name="text">
                    <meta>
                        <title lang="en">Text</title>
                        <title lang="de">Text</title>
                    </meta>

                    <properties>
                        <property name="text" type="text_editor">
                            <meta>
                                <title lang="en">Text</title>
                                <title lang="de">Text</title>
                            </meta>

                            <tag name="sulu.search.field" type="string"/>
                        </property>
                    </properties>
                </type>

                <type name="media">
                    <meta>
                        <title lang="en">Media</title>
                        <title lang="de">Medien</title>
                    </meta>

                    <properties>
                        <property name="media" type="media_selection">
                            <meta>
                                <title lang="en">Media</title>
                                <title lang="de">Medien</title>
                            </meta>
                        </property>
                    </properties>
                </type>
            </types>
        </block>

        <property name="examples" type="example_selection">
            <meta>
                <title lang="en">Examples</title>
                <title lang="de">Beispiele</title>
            </meta>
        </property>
    </properties>
</template>
